{
  "active": true,
  "name": "HR 직원 정보 조회",
  "schema": "skill-1.0.0",
  "version": "1.0.0",
  "hubId": "hr-employee-basic",
  "author": "teamplgpt",
  "description": "사원번호로 직원 정보(이름, 부서, 직위, 직급 등 13개 필드)를 조회합니다. PII(개인식별정보)는 포함하지 않습니다. 응답 데이터를 받으면 반드시 사용자가 보기 편하도록 마크다운 표(Markdown Table) 형식으로 정리해서 보여주세요.",
  "entrypoint": {
    "file": "handler.js",
    "params": {
      "emp_no": {
        "description": "조회할 직원의 사원번호 (필수). 예: '12345', '00100'",
        "type": "string"
      },
      "site_id": {
        "description": "사이트 ID (선택). 멀티사이트 환경에서 특정 사이트를 지정할 때 사용. 보통 생략 가능.",
        "type": "string"
      }
    }
  },
  "setup_args": {
    "HR_API_BASE_URL": {
      "type": "string",
      "required": true,
      "input": {
        "type": "text",
        "default": "http://host.docker.internal:8000",
        "placeholder": "http://host.docker.internal:8000",
        "hint": "HR REST API 서버 주소. Docker: host.docker.internal, Local: localhost"
      },
      "value": "http://localhost:8000"
    }
  },
  "examples": [
    {
      "prompt": "사원번호 12345의 기본정보 알려줘",
      "call": "{\"emp_no\": \"12345\"}"
    },
    {
      "prompt": "직원 00100번 정보 조회해줘",
      "call": "{\"emp_no\": \"00100\"}"
    },
    {
      "prompt": "사번 A0001 직원 기본정보 조회",
      "call": "{\"emp_no\": \"A0001\"}"
    }
  ],
  "imported": true,
  "license": "MIT"
}
